"ElementName","DataType","Size","Required","ElementDescription","ValueRange","Notes","Aliases"
"subjectkey","GUID","","Required","The NDAR Global Unique Identifier (GUID) for research subject","NDAR*","",""
"src_subject_id","String","20","Required","Subject ID how it's defined in lab/project","","",""
"interview_age","Integer","","Required","Age in months at the time of the interview/test/sampling/imaging.","0 :: 1260","Age is rounded to chronological month. If the research participant is 15-days-old at time of interview, the appropriate value would be 0 months. If the participant is 16-days-old, the value would be 1 month.",""
"interview_date","Date","","Required","Date on which the interview/genetic test/sampling/imaging/biospecimen was completed. MM/DD/YYYY","","",""
"sex","String","20","Required","Sex of subject at birth","M;F; O; NR","M = Male; F = Female; O=Other; NR = Not reported","gender"
"eventname","String","60","Recommended","The event name for which the data was collected","","",""
"fitb_s1_q1_y","Integer","","Recommended","In your opinion, compared to other boys/girls your age, how much physical activity do you do?","1 ; 2 ; 3 ; 4 ; 5","1 = Much less; 2 = A little less; 3 = About the same; 4 = A little more; 5 = Much more","fitbit_baseline_s1_q1,fitbit_pilot_pre_s1_q1�"
"fitb_s2_q1_y","Integer","","Recommended","In your opinion, compared to other boys/girls your age, how many sedentary behaviors do you do?","1 ; 2 ; 3 ; 4 ; 5","1 = Much less; 2 = A little less; 3 = About the same; 4 = A little more; 5 = Much more","fitbit_baseline_s2_q1,fitbit_pilot_pre_s2_q1�"
"fitb_s3_q1_y","Integer","","Recommended","In your opinion, compared to other boys/girls your age, how much sleep do you get?","1 ; 2 ; 3 ; 4 ; 5","1 = Much less; 2 = A little less; 3 = About the same; 4 = A little more; 5 = Much more","fitbit_baseline_s3_q1,fitbit_pilot_pre_s3_q1"
