"ElementName","DataType","Size","Required","ElementDescription","ValueRange","Notes","Aliases"
"subjectkey","GUID","","Required","The NDAR Global Unique Identifier (GUID) for research subject","NDAR*","",""
"src_subject_id","String","20","Required","Subject ID how it's defined in lab/project","","",""
"interview_date","Date","","Required","Date on which the interview/genetic test/sampling/imaging/biospecimen was completed. MM/DD/YYYY","","",""
"interview_age","Integer","","Required","Age in months at the time of the interview/test/sampling/imaging.","0 :: 1260","Age is rounded to chronological month. If the research participant is 15-days-old at time of interview, the appropriate value would be 0 months. If the participant is 16-days-old, the value would be 1 month.",""
"sex","String","20","Required","Sex of subject at birth","M;F; O; NR","M = Male; F = Female; O=Other; NR = Not reported","gender"
"eventname","String","60","Required","The event name for which the data was collected","","",""
"socialdev_contact_type_v","Integer","","Recommended","Contact Type:","1::3","1=  Phone; 2=  Email; 3=  In-person",""
"socialdev_contact_result_v","Integer","","Recommended","Result of Contact:","1::4","1=  continue to contact; 2 = scheduled; 3=  soft decline (this time only); 4 = hard decline",""
