"ElementName","DataType","Size","Required","ElementDescription","ValueRange","Notes","Aliases"
"subjectkey","GUID","","Required","The NDAR Global Unique Identifier (GUID) for research subject","NDAR*","",""
"src_subject_id","String","20","Required","Subject ID how it's defined in lab/project","","",""
"interview_age","Integer","","Required","Age in months at the time of the interview/test/sampling/imaging.","0 :: 1260","Age is rounded to chronological month. If the research participant is 15-days-old at time of interview, the appropriate value would be 0 months. If the participant is 16-days-old, the value would be 1 month.",""
"interview_date","Date","","Required","Date on which the interview/genetic test/sampling/imaging/biospecimen was completed. MM/DD/YYYY","","",""
"sex","String","20","Required","Sex of subject at birth","M;F; O; NR","M = Male; F = Female; O=Other; NR = Not reported","gender"
"eventname","String","60","Recommended","The event name for which the data was collected","","",""
"ascq_section_q01","Integer","","Recommended","Cigarettes help with concentration.","1 ; 2 ; 3 ; 4 ; 5 ; 0","1 = Never; 2 = Rarely; 3 = Sometimes; 4 = Often; 5 = Always; 0 = Uncertain / tlfb_tob_c_l   == '1' ||  tlfb_tob_l   == '1'","su_ascq_q01"
"ascq_section_q02","Integer","","Recommended","When someone is sad, smoking helps them feel better.","1 ; 2 ; 3 ; 4 ; 5 ; 0","1 = Never; 2 = Rarely; 3 = Sometimes; 4 = Often; 5 = Always; 0 = Uncertain / tlfb_tob_c_l   == '1' ||  tlfb_tob_l   == '1'","su_ascq_q02"
"ascq_section_q03","Integer","","Recommended","The look and feel of a cigarette in the mouth is good.","1 ; 2 ; 3 ; 4 ; 5 ; 0","1 = Never; 2 = Rarely; 3 = Sometimes; 4 = Often; 5 = Always; 0 = Uncertain / tlfb_tob_c_l   == '1' ||  tlfb_tob_l   == '1'","su_ascq_q03"
"ascq_section_q04","Integer","","Recommended","Parties are more enjoyable when a person is smoking.","1 ; 2 ; 3 ; 4 ; 5 ; 0","1 = Never; 2 = Rarely; 3 = Sometimes; 4 = Often; 5 = Always; 0 = Uncertain / tlfb_tob_c_l   == '1' ||  tlfb_tob_l   == '1'","su_ascq_q04"
"ascq_section_q05","Integer","","Recommended","Smoking will make a person cough.","1 ; 2 ; 3 ; 4 ; 5 ; 0","1 = Never; 2 = Rarely; 3 = Sometimes; 4 = Often; 5 = Always; 0 = Uncertain / tlfb_tob_c_l   == '1' ||  tlfb_tob_l   == '1'","su_ascq_q05"
"ascq_section_q06","Integer","","Recommended","Smoking makes people look ridiculous or silly.","1 ; 2 ; 3 ; 4 ; 5 ; 0","1 = Never; 2 = Rarely; 3 = Sometimes; 4 = Often; 5 = Always; 0 = Uncertain / tlfb_tob_c_l   == '1' ||  tlfb_tob_l   == '1'","su_ascq_q06"
"res_tobacco_q01_l","Integer","","Recommended","While smoking your very first cigarette, did you have pleasurable sensations (did you feel a pleasurable buzz or rush; relaxed, dizzy)?","1 ; 2 ; 3 ; 4","1 = None1; 2 = 2; 3 = 3; 4 = Intense4 / tlfb_cig_use_l  == '1' &&  tlfb_cig_use_c_l   == 0","su_subj_resp_nic_q01_l"
"res_tobacco_q02_l","Integer","","Recommended","While smoking your very first cigarette, did you have unpleasant sensations (did you feel nausea, did you cough)?","1 ; 2 ; 3 ; 4","1 = None1; 2 = 2; 3 = 3; 4 = Intense4 / tlfb_cig_use_l  == '1' &&  tlfb_cig_use_c_l   == 0","su_subj_resp_nic_q02_l"
"res_tobacco_q08_l","Integer","","Recommended","Were you alone the first time you experimented with cigarettes?","1 ; 2","1 = Yes; 2 = No / tlfb_cig_use_l  == '1' &&  tlfb_cig_use_c_l   == 0","su_subj_resp_nic_q03_l"
"res_tobacco_q09_l","Integer","","Recommended","While using your very first e-cigarette or e-hookah, did you have pleasurable sensations (did you feel a pleasurable buzz or rush, relaxed, dizzy)?","1 ; 2 ; 3 ; 4","1 = None1; 2 = 2; 3 = 3; 4 = Intense4 / tlfb_ecig_use_l  == '1' ||  tlfb_hookah_use_l  == '1'  &&  tlfb_ecig_use_c_l  == '0' &&  tlfb_hookah_use_c_l  == '0'","su_subj_resp_nic_q04_l"
"res_tobacco_q10_l","Integer","","Recommended","While using your very first e-cigarette or e-hookah, did you have unpleasant sensations (did you feel nausea, did you cough)?","1 ; 2 ; 3 ; 4","1 = None1; 2 = 2; 3 = 3; 4 = Intense4 / tlfb_ecig_use_l  == '1' ||  tlfb_hookah_use_l  == '1'  &&  tlfb_ecig_use_c_l  == '0' &&  tlfb_hookah_use_c_l  == '0'","su_subj_resp_nic_q05_l"
"res_tobacco_q16_l","Integer","","Recommended","Were you alone the first time you experimented with an e-cigarette or e-hookah?","1 ; 2","1 = Yes; 2 = No / tlfb_ecig_use_l  == '1' ||  tlfb_hookah_use_l  == '1'  &&  tlfb_ecig_use_c_l  == '0' &&  tlfb_hookah_use_c_l  == '0'","su_subj_resp_nic_q06_l"
"res_tobacco_q17_l","Integer","","Recommended","While using your very first smokeless tobacco such as snus or chew, did you have pleasurable sensations (did you feel a pleasurable buzz or rush, relaxed, dizzy)?","1 ; 2 ; 3 ; 4","1 = None1; 2 = 2; 3 = 3; 4 = Intense4 / tlfb_chew_use_l  == '1' &&  tlfb_chew_use_c_l  == '0'","su_subj_resp_nic_q07_l"
"res_tobacco_q18_l","Integer","","Recommended","While using your very first smokeless tobacco such as snus or chew, did you have unpleasant sensations (did you feel nausea, did you cough)?","1 ; 2 ; 3 ; 4","1 = None1; 2 = 2; 3 = 3; 4 = Intense4 / tlfb_chew_use_l  == '1' &&  tlfb_chew_use_c_l  == '0'","su_subj_resp_nic_q08_l"
"res_tobacco_q24_l","Integer","","Recommended","Were you alone the first time you experimented with smokeless tobacco such as snus or chew?","1 ; 2","1 = Yes; 2 = No / tlfb_chew_use_l  == '1' &&  tlfb_chew_use_c_l  == '0'","su_subj_resp_nic_q09_l"
"path_nic_dep_q01_l","Integer","","Recommended","How soon after you wake up do you want to use tobacco?","1 ; 2 ; 3 ; 4 ; 5","1 = Within 5 minutes; 2 = From 6 to 30 minutes; 3 = From more than 30 minutes to 1 hour; 4 = After more than 1 hour but less than 24 hours; 5 = I rarely want to use tobacco / xskipout_tob_l   == '1'","su_path_nic_dep_q01_l"
"path_nic_dep_q02_l","Integer","","Recommended","Do you ever have strong craving to use tobacco?","1 ; 0","1 = Yes; 0 = No / xskipout_tob_l   == '1'","su_path_nic_dep_q02_l"
"path_nic_dep_q03_l","Integer","","Recommended","Have you ever felt like you really needed to use tobacco?","1 ; 0","1 = Yes; 0 = No / xskipout_tob_l   == '1'","su_path_nic_dep_q03_l"
"path_nic_dep_q04_l","Integer","","Recommended","I find myself reaching for a tobacco product without thinking about it.","1 ; 2 ; 3 ; 4 ; 5","1 = Not true of me at all1; 2 = 2; 3 = 3; 4 = 4; 5 = Extremely true of me5 / xskipout_tob_l   == '1'","su_path_nic_dep_q04_l"
"path_nic_dep_q05_l","Integer","","Recommended","I frequently crave tobacco.","1 ; 2 ; 3 ; 4 ; 5","1 = Not true of me at all1; 2 = 2; 3 = 3; 4 = 4; 5 = Extremely true of me5 / xskipout_tob_l   == '1'","su_path_nic_dep_q05_l"
"path_nic_dep_q06_l","Integer","","Recommended","My tobacco use is out of control.","1 ; 2 ; 3 ; 4 ; 5","1 = Not true of me at all1; 2 = 2; 3 = 3; 4 = 4; 5 = Extremely true of me5 / xskipout_tob_l   == '1'","su_path_nic_dep_q06_l"
"path_nic_dep_q07_l","Integer","","Recommended","Using tobacco really helps me feel better if I've been feeling down.","1 ; 2 ; 3 ; 4 ; 5","1 = Not true of me at all1; 2 = 2; 3 = 3; 4 = 4; 5 = Extremely true of me5 / xskipout_tob_l   == '1'","su_path_nic_dep_q07_l"
"path_nic_dep_q08_l","Integer","","Recommended","Using tobacco helps me think better.","1 ; 2 ; 3 ; 4 ; 5","1 = Not true of me at all1; 2 = 2; 3 = 3; 4 = 4; 5 = Extremely true of me5 / xskipout_tob_l   == '1'","su_path_nic_dep_q08_l"
"path_nic_dep_q09_l","Integer","","Recommended","I would feel alone without my tobacco.","1 ; 2 ; 3 ; 4 ; 5","1 = Not true of me at all1; 2 = 2; 3 = 3; 4 = 4; 5 = Extremely true of me5 / xskipout_tob_l   == '1'","su_path_nic_dep_q09_l"
"path_nic_dep_q10_l","Integer","","Recommended","I usually want to use my tobacco right after I wake up.","1 ; 2 ; 3 ; 4 ; 5","1 = Not true of me at all1; 2 = 2; 3 = 3; 4 = 4; 5 = Extremely true of me5 / xskipout_tob_l   == '1'","su_path_nic_dep_q10_l"
"su_nic_admin","Integer","","Recommended","Please indicate how instrument was administered:","1::3","1=RA-Administered ; 2=Youth Self_Administered ; 3=Combination [sched_delay] = '7'",""
"su_cig_motiv_18","Integer","","Recommended","I smoke to be liked","1 ; 2 ; 3 ; 4 ; 5","1=Not at all true ; 2=A little true ; 3=Somewhat true ; 4=Pretty true ; 5=Very true [xskipout_nic] = 1'' and [event-name] = ''4_year_follow_up_y_arm_1''''",""
"su_cig_motiv_02","Integer","","Recommended","Smoking makes it easier to be sociable with others","1 ; 2 ; 3 ; 4 ; 5","1=Not at all true ; 2=A little true ; 3=Somewhat true ; 4=Pretty true ; 5=Very true [xskipout_nic] = 1'' and [event-name] = ''4_year_follow_up_y_arm_1''''",""
"su_ends_motiv_05","Integer","","Recommended","Vaping makes you feel more energetic","1 ; 2 ; 3 ; 4 ; 5","1=Not at all true ; 2=A little true ; 3=Somewhat true ; 4=Pretty true ; 5=Very true [xskipout_end] = 1'' and [event-name] = ''4_year_follow_up_y_arm_1''''",""
"su_ends_motiv_06","Integer","","Recommended","Vaping helps you concentrate on things","1 ; 2 ; 3 ; 4 ; 5","1=Not at all true ; 2=A little true ; 3=Somewhat true ; 4=Pretty true ; 5=Very true [xskipout_end] = 1'' and [event-name] = ''4_year_follow_up_y_arm_1''''",""
"su_cig_motiv_10","Integer","","Recommended","Smoking is something to do when you're bored","1 ; 2 ; 3 ; 4 ; 5","1=Not at all true ; 2=A little true ; 3=Somewhat true ; 4=Pretty true ; 5=Very true [xskipout_nic] = 1'' and [event-name] = ''4_year_follow_up_y_arm_1''''",""
"su_ends_motiv_01","Integer","","Recommended","Vaping helps you fit in with other people","1 ; 2 ; 3 ; 4 ; 5","1=Not at all true ; 2=A little true ; 3=Somewhat true ; 4=Pretty true ; 5=Very true [xskipout_end] = 1'' and [event-name] = ''4_year_follow_up_y_arm_1''''",""
"su_cig_motiv_04","Integer","","Recommended","Smoking makes social gatherings more fun","1 ; 2 ; 3 ; 4 ; 5","1=Not at all true ; 2=A little true ; 3=Somewhat true ; 4=Pretty true ; 5=Very true [xskipout_nic] = 1'' and [event-name] = ''4_year_follow_up_y_arm_1''''",""
"su_ends_motiv_03","Integer","","Recommended","Vaping helps you enjoy a party","1 ; 2 ; 3 ; 4 ; 5","1=Not at all true ; 2=A little true ; 3=Somewhat true ; 4=Pretty true ; 5=Very true [xskipout_end] = 1'' and [event-name] = ''4_year_follow_up_y_arm_1''''",""
"su_cig_motiv_07","Integer","","Recommended","Smoking makes you feel more self-confident","1 ; 2 ; 3 ; 4 ; 5","1=Not at all true ; 2=A little true ; 3=Somewhat true ; 4=Pretty true ; 5=Very true [xskipout_nic] = 1'' and [event-name] = ''4_year_follow_up_y_arm_1''''",""
"su_cig_motiv_19","Integer","","Recommended","I smoke so I won't feel left out","1 ; 2 ; 3 ; 4 ; 5","1=Not at all true ; 2=A little true ; 3=Somewhat true ; 4=Pretty true ; 5=Very true [xskipout_nic] = 1'' and [event-name] = ''4_year_follow_up_y_arm_1''''",""
"su_cig_motiv_13","Integer","","Recommended","Smoking helps you when you're feeling angry","1 ; 2 ; 3 ; 4 ; 5","1=Not at all true ; 2=A little true ; 3=Somewhat true ; 4=Pretty true ; 5=Very true [xskipout_nic] = 1'' and [event-name] = ''4_year_follow_up_y_arm_1''''",""
"su_cig_motiv_15","Integer","","Recommended","Smoking cheers you up when you're in a bad mood","1 ; 2 ; 3 ; 4 ; 5","1=Not at all true ; 2=A little true ; 3=Somewhat true ; 4=Pretty true ; 5=Very true [xskipout_nic] = 1'' and [event-name] = ''4_year_follow_up_y_arm_1''''",""
"su_ends_motiv_08","Integer","","Recommended","Vaping makes you feel more sure of yourself","1 ; 2 ; 3 ; 4 ; 5","1=Not at all true ; 2=A little true ; 3=Somewhat true ; 4=Pretty true ; 5=Very true [xskipout_end] = 1'' and [event-name] = ''4_year_follow_up_y_arm_1''''",""
"su_ends_motiv_07","Integer","","Recommended","Vaping makes you feel more self-confident","1 ; 2 ; 3 ; 4 ; 5","1=Not at all true ; 2=A little true ; 3=Somewhat true ; 4=Pretty true ; 5=Very true [xskipout_end] = 1'' and [event-name] = ''4_year_follow_up_y_arm_1''''",""
"su_ends_motives_17","Integer","","Recommended","I vape to fit in with a group I like","1 ; 2 ; 3 ; 4 ; 5","1=Not at all true ; 2=A little true ; 3=Somewhat true ; 4=Pretty true ; 5=Very true [xskipout_end] = 1'' and [event-name] = ''4_year_follow_up_y_arm_1''''",""
"su_ends_motiv_10","Integer","","Recommended","Vaping is something to do when you're bored","1 ; 2 ; 3 ; 4 ; 5","1=Not at all true ; 2=A little true ; 3=Somewhat true ; 4=Pretty true ; 5=Very true [xskipout_end] = 1'' and [event-name] = ''4_year_follow_up_y_arm_1''''",""
"su_cig_motiv_03","Integer","","Recommended","Smoking helps you enjoy a party","1 ; 2 ; 3 ; 4 ; 5","1=Not at all true ; 2=A little true ; 3=Somewhat true ; 4=Pretty true ; 5=Very true [xskipout_nic] = 1'' and [event-name] = ''4_year_follow_up_y_arm_1''''",""
"su_ends_motiv_02","Integer","","Recommended","Vaping makes it easier to be sociable with others","1 ; 2 ; 3 ; 4 ; 5","1=Not at all true ; 2=A little true ; 3=Somewhat true ; 4=Pretty true ; 5=Very true [xskipout_end] = 1'' and [event-name] = ''4_year_follow_up_y_arm_1''''",""
"su_cig_motiv_08","Integer","","Recommended","Smoking makes you feel more sure of yourself","1 ; 2 ; 3 ; 4 ; 5","1=Not at all true ; 2=A little true ; 3=Somewhat true ; 4=Pretty true ; 5=Very true [xskipout_nic] = 1'' and [event-name] = ''4_year_follow_up_y_arm_1''''",""
"su_cig_motiv_16","Integer","","Recommended","I often smoke without thinking about it","1 ; 2 ; 3 ; 4 ; 5","1=Not at all true ; 2=A little true ; 3=Somewhat true ; 4=Pretty true ; 5=Very true [xskipout_nic] = 1'' and [event-name] = ''4_year_follow_up_y_arm_1''''",""
"su_cig_motiv_17","Integer","","Recommended","I smoke to fit in with a group I like","1 ; 2 ; 3 ; 4 ; 5","1=Not at all true ; 2=A little true ; 3=Somewhat true ; 4=Pretty true ; 5=Very true [xskipout_nic] = 1'' and [event-name] = ''4_year_follow_up_y_arm_1''''",""
"su_ends_motives_19","Integer","","Recommended","I vape so I won't feel left out","1 ; 2 ; 3 ; 4 ; 5","1=Not at all true ; 2=A little true ; 3=Somewhat true ; 4=Pretty true ; 5=Very true [xskipout_end] = 1'' and [event-name] = ''4_year_follow_up_y_arm_1''''",""
"su_cig_motiv_05","Integer","","Recommended","Smoking makes you feel more energetic","1 ; 2 ; 3 ; 4 ; 5","1=Not at all true ; 2=A little true ; 3=Somewhat true ; 4=Pretty true ; 5=Very true [xskipout_nic] = 1'' and [event-name] = ''4_year_follow_up_y_arm_1''''",""
"su_ends_motiv_13","Integer","","Recommended","Vaping helps you when you're feeling angry","1 ; 2 ; 3 ; 4 ; 5","1=Not at all true ; 2=A little true ; 3=Somewhat true ; 4=Pretty true ; 5=Very true [xskipout_end] = 1'' and [event-name] = ''4_year_follow_up_y_arm_1''''",""
"su_ends_motives_18","Integer","","Recommended","I vape to be liked","1 ; 2 ; 3 ; 4 ; 5","1=Not at all true ; 2=A little true ; 3=Somewhat true ; 4=Pretty true ; 5=Very true [xskipout_end] = 1'' and [event-name] = ''4_year_follow_up_y_arm_1''''",""
"su_cig_motiv_12","Integer","","Recommended","Smoking helps you calm down when you're feeling tense and nervous","1 ; 2 ; 3 ; 4 ; 5","1=Not at all true ; 2=A little true ; 3=Somewhat true ; 4=Pretty true ; 5=Very true [xskipout_nic] = 1'' and [event-name] = ''4_year_follow_up_y_arm_1''''",""
"su_cig_motiv_06","Integer","","Recommended","Smoking helps you concentrate on things","1 ; 2 ; 3 ; 4 ; 5","1=Not at all true ; 2=A little true ; 3=Somewhat true ; 4=Pretty true ; 5=Very true [xskipout_nic] = 1'' and [event-name] = ''4_year_follow_up_y_arm_1''''",""
"su_ends_motiv_11","Integer","","Recommended","Vaping helps you forget about worries","1 ; 2 ; 3 ; 4 ; 5","1=Not at all true ; 2=A little true ; 3=Somewhat true ; 4=Pretty true ; 5=Very true [xskipout_end] = 1'' and [event-name] = ''4_year_follow_up_y_arm_1''''",""
"su_ends_motiv_04","Integer","","Recommended","Vaping makes social gatherings more fun","1 ; 2 ; 3 ; 4 ; 5","1=Not at all true ; 2=A little true ; 3=Somewhat true ; 4=Pretty true ; 5=Very true [xskipout_end] = 1'' and [event-name] = ''4_year_follow_up_y_arm_1''''",""
"su_ends_motiv_15","Integer","","Recommended","Vaping cheers you up when you're in a bad mood","1 ; 2 ; 3 ; 4 ; 5","1=Not at all true ; 2=A little true ; 3=Somewhat true ; 4=Pretty true ; 5=Very true [xskipout_end] = 1'' and [event-name] = ''4_year_follow_up_y_arm_1''''",""
"su_cig_motiv_11","Integer","","Recommended","Smoking helps you forget about worries","1 ; 2 ; 3 ; 4 ; 5","1=Not at all true ; 2=A little true ; 3=Somewhat true ; 4=Pretty true ; 5=Very true [xskipout_nic] = 1'' and [event-name] = ''4_year_follow_up_y_arm_1''''",""
"su_cig_motiv_01","Integer","","Recommended","Smoking helps you fit in with other people","1 ; 2 ; 3 ; 4 ; 5","1=Not at all true ; 2=A little true ; 3=Somewhat true ; 4=Pretty true ; 5=Very true [xskipout_nic] = 1'' and [event-name] = ''4_year_follow_up_y_arm_1''''",""
"su_ends_motiv_14","Integer","","Recommended","Vapingmakes you feel more relaxed","1 ; 2 ; 3 ; 4 ; 5","1=Not at all true ; 2=A little true ; 3=Somewhat true ; 4=Pretty true ; 5=Very true [xskipout_end] = 1'' and [event-name] = ''4_year_follow_up_y_arm_1''''",""
"su_ceq_q01","Integer","","Recommended","Become more popular","0::9","0=Unlikely ; 1=1 ; 2=2 ; 3=3 ; 4=4 ; 5=5 ; 6=6 ; 7=7 ; 8=8 ; 9=Likely  [event-name] = ''3_year_follow_up_y_arm_1''",""
"su_ceq_q02","Integer","","Recommended","Feel relaxed","0::9","0=Unlikely ; 1=1 ; 2=2 ; 3=3 ; 4=4 ; 5=5 ; 6=6 ; 7=7 ; 8=8 ; 9=Likely  [event-name] = ''3_year_follow_up_y_arm_1''",""
"su_ceq_q03","Integer","","Recommended","Enjoy ''smoking'' without bothering others","0::9","0=Unlikely ; 1=1 ; 2=2 ; 3=3 ; 4=4 ; 5=5 ; 6=6 ; 7=7 ; 8=8 ; 9=Likely  [event-name] = ''3_year_follow_up_y_arm_1''",""
"su_ceq_q04","Integer","","Recommended","Smell good","0::9","0=Unlikely ; 1=1 ; 2=2 ; 3=3 ; 4=4 ; 5=5 ; 6=6 ; 7=7 ; 8=8 ; 9=Likely  [event-name] = ''3_year_follow_up_y_arm_1''",""
"su_ceq_q05","Integer","","Recommended","Hurt your lungs","0::9","0=Unlikely ; 1=1 ; 2=2 ; 3=3 ; 4=4 ; 5=5 ; 6=6 ; 7=7 ; 8=8 ; 9=Likely  [event-name] = ''3_year_follow_up_y_arm_1''",""
"su_ceq_q06","Integer","","Recommended","Look awkward","0::9","0=Unlikely ; 1=1 ; 2=2 ; 3=3 ; 4=4 ; 5=5 ; 6=6 ; 7=7 ; 8=8 ; 9=Likely  [event-name] = ''3_year_follow_up_y_arm_1''",""
"su_ceq_q07","Integer","","Recommended","Become addicted to e-cigarettes","0::9","0=Unlikely ; 1=1 ; 2=2 ; 3=3 ; 4=4 ; 5=5 ; 6=6 ; 7=7 ; 8=8 ; 9=Likely  [event-name] = ''3_year_follow_up_y_arm_1''",""
"su_ceq_q08","Integer","","Recommended","Have a bad taste in your mouth","0::9","0=Unlikely ; 1=1 ; 2=2 ; 3=3 ; 4=4 ; 5=5 ; 6=6 ; 7=7 ; 8=8 ; 9=Likely  [event-name] = ''3_year_follow_up_y_arm_1''",""
"su_ends_motiv_09","Integer","","Recommended","You can vape when there's nothing better to do","1 ; 2 ; 3 ; 4 ; 5","1=Not at all true ; 2=A little true ; 3=Somewhat true ; 4=Pretty true ; 5=Very true [xskipout_end] = 1'' and [event-name] = ''4_year_follow_up_y_arm_1''''",""
"su_ends_motives_16","Integer","","Recommended","I often vape without thinking about it","1 ; 2 ; 3 ; 4 ; 5","1=Not at all true ; 2=A little true ; 3=Somewhat true ; 4=Pretty true ; 5=Very true [xskipout_end] = 1'' and [event-name] = ''4_year_follow_up_y_arm_1''''",""
"su_cig_motiv_09","Integer","","Recommended","You can smoke when there's nothing better to do","1 ; 2 ; 3 ; 4 ; 5","1=Not at all true ; 2=A little true ; 3=Somewhat true ; 4=Pretty true ; 5=Very true [xskipout_nic] = 1'' and [event-name] = ''4_year_follow_up_y_arm_1''''",""
"su_cig_motiv_14","Integer","","Recommended","Smoking makes you feel more relaxed","1 ; 2 ; 3 ; 4 ; 5","1=Not at all true ; 2=A little true ; 3=Somewhat true ; 4=Pretty true ; 5=Very true [xskipout_nic] = 1'' and [event-name] = ''4_year_follow_up_y_arm_1''''",""
"su_ends_motiv_12","Integer","","Recommended","Vaping helps you calm down when you're feeling tense and nervous","1 ; 2 ; 3 ; 4 ; 5","1=Not at all true ; 2=A little true ; 3=Somewhat true ; 4=Pretty true ; 5=Very true [xskipout_end] = 1'' and [event-name] = ''4_year_follow_up_y_arm_1''''",""
"su_ends_reasons___1","Integer","","Recommended","Please select all of the reasons why you used an electronic nicotine or vaping product, such as e-cigarettes, vape pens, or JUUL, within the past year: 1, 1, I believe it is less harmful to my health","1;0","1 = Yes; 0 = No  [xskipout_end] = 1'' and [event-name] = ''4_year_follow_up_y_arm_1''''",""
"su_ends_reasons___9","Integer","","Recommended","Please select all of the reasons why you used an electronic nicotine or vaping product, such as e-cigarettes, vape pens, or JUUL, within the past year: 9, 9, To avoid bothering others with tobacco","1;0","1 = Yes; 0 = No  [xskipout_end] = 1'' and [event-name] = ''4_year_follow_up_y_arm_1''''",""
"su_ends_reasons___10","Integer","","Recommended","Please select all of the reasons why you used an electronic nicotine or vaping product, such as e-cigarettes, vape pens, or JUUL, within the past year: 10, 10, To deal with situations where I can't smoke (e.g., work)","1;0","1 = Yes; 0 = No  [xskipout_end] = 1'' and [event-name] = ''4_year_follow_up_y_arm_1''''",""
"su_ends_reasons___11","Integer","","Recommended","Please select all of the reasons why you used an electronic nicotine or vaping product, such as e-cigarettes, vape pens, or JUUL, within the past year:  11, 11, To avoid having to go outside to smoke ","1;0","1 = Yes; 0 = No  [xskipout_end] = 1'' and [event-name] = ''4_year_follow_up_y_arm_1''''",""
"su_ends_reasons___12","Integer","","Recommended","Please select all of the reasons why you used an electronic nicotine or vaping product, such as e-cigarettes, vape pens, or JUUL, within the past year:  12, 12, To reduce tobacco consumption in preparation of a quit attempt","1;0","1 = Yes; 0 = No  [xskipout_end] = 1'' and [event-name] = ''4_year_follow_up_y_arm_1''''",""
"su_ends_reasons___13","Integer","","Recommended","Please select all of the reasons why you used an electronic nicotine or vaping product, such as e-cigarettes, vape pens, or JUUL, within the past year: 13, 13, To reduce tobacco consumption with NO intention to quit smoking","1;0","1 = Yes; 0 = No  [xskipout_end] = 1'' and [event-name] = ''4_year_follow_up_y_arm_1''''",""
"su_ends_reasons___14","Integer","","Recommended","Please select all of the reasons why you used an electronic nicotine or vaping product, such as e-cigarettes, vape pens, or JUUL, within the past year: 14, 14, Unable to stop using it","1;0","1 = Yes; 0 = No  [xskipout_end] = 1'' and [event-name] = ''4_year_follow_up_y_arm_1''''",""
"su_ends_reasons___15","Integer","","Recommended","Please select all of the reasons why you used an electronic nicotine or vaping product, such as e-cigarettes, vape pens, or JUUL, within the past year: 15, 15, Because my parents use","1;0","1 = Yes; 0 = No  [xskipout_end] = 1'' and [event-name] = ''4_year_follow_up_y_arm_1''''",""
"su_ends_reasons___16","Integer","","Recommended","Please select all of the reasons why you used an electronic nicotine or vaping product, such as e-cigarettes, vape pens, or JUUL, within the past year: 16, 16, Because my siblings use","1;0","1 = Yes; 0 = No  [xskipout_end] = 1'' and [event-name] = ''4_year_follow_up_y_arm_1''''",""
"su_ends_reasons___17","Integer","","Recommended","Please select all of the reasons why you used an electronic nicotine or vaping product, such as e-cigarettes, vape pens, or JUUL, within the past year: 17, 17, Because many of my friends use","1;0","1 = Yes; 0 = No  [xskipout_end] = 1'' and [event-name] = ''4_year_follow_up_y_arm_1''''",""
"su_ends_reasons___18","Integer","","Recommended","Please select all of the reasons why you used an electronic nicotine or vaping product, such as e-cigarettes, vape pens, or JUUL, within the past year:  18, 18, Because many people my age use","1;0","1 = Yes; 0 = No  [xskipout_end] = 1'' and [event-name] = ''4_year_follow_up_y_arm_1''''",""
"su_ends_reasons___19","Integer","","Recommended","Please select all of the reasons why you used an electronic nicotine or vaping product, such as e-cigarettes, vape pens, or JUUL, within the past year: 20, 20, To calm me down","1;0","1 = Yes; 0 = No  [xskipout_end] = 1'' and [event-name] = ''4_year_follow_up_y_arm_1''''",""
"su_ends_reasons___20","Integer","","Recommended","Please select all of the reasons why you used an electronic nicotine or vaping product, such as e-cigarettes, vape pens, or JUUL, within the past year:  21, 21, To make me feel less sad","1;0","1 = Yes; 0 = No  [xskipout_end] = 1'' and [event-name] = ''4_year_follow_up_y_arm_1''''",""
"su_ends_reasons___21","Integer","","Recommended","Please select all of the reasons why you used an electronic nicotine or vaping product such as e-cigarettes vape pens or JUUL within the past year:1=I believe it is less harmful to my health;2=I believe it is less harmful to others;3=I prefer the taste of an e-cigarette;4=E-cigarettes are less toxic than tobacco;5=Todealwithcravingfortobacco;6=To quit smoking or avoid relapsing;7=To deal with withdrawal symptoms;8=E-cigarettes are cheaper than smoking;9=To avoid bothering others with tobacco;10=To deal with situations where I can't smoke;11=To avoid having to go outside to smoke;12=To reduce tobacco consumption in preparation of a quit attempt;13=To reduce tobacco consumption with NO intention to quit smoking;14=Unable to stop using it;15=Because my parents use;16=Because my siblings use;17=Because many of my friends use;18=Because many people my age use;19=To help me fit in;20=To calm me down;21=Tomakemefeellesssad;22=Because it is fun;23=Because I'm curious what it's like;24=Other","1;0","1 = Yes; 0 = No  [xskipout_end] = 1'' and [event-name] = ''4_year_follow_up_y_arm_1''''",""
"su_ends_reasons___22","Integer","","Recommended","Please select all of the reasons why you used an electronic nicotine or vaping product, such as e-cigarettes, vape pens, or JUUL, within the past year: 22, 22, Because it is fun","1;0","1 = Yes; 0 = No  [xskipout_end] = 1'' and [event-name] = ''4_year_follow_up_y_arm_1''''",""
